{
  "slug": "stuart-homeowners",
  "domain": "stuarthomeownersinsurance.com",
  "brand": { "name": "Stuart Homeowners Insurance (Demo)", "parent": "WICFL", "logo": "/logo.svg" },
  "niche": { "product": "homeowners", "audience": "homeowner" },
  "geo": { "city": "Stuart", "county": "Martin", "state": "FL", "serviceArea": ["Stuart", "Port Salerno", "Palm City"] },
  "locale": { "primary": "en", "alternates": [] },
  "contact": {
    "trackingPhone": "+17722470106",
    "displayPhone": "(772) 247-0106",
    "email": "info@stuarthomeownersinsurance.com"
  },
  "products": ["homeowners"],
  "seo": {
    "title": "Stuart Homeowners Insurance | Internal Demo",
    "description": "Internal preview of the Stuart, Florida homeowners insurance microsite template. Not published content and not insurance advice or an offer of coverage.",
    "primaryKeyword": "Stuart homeowners insurance demo",
    "secondaryKeywords": ["waterfront homeowners insurance Stuart FL", "Martin County high value home insurance demo"]
  },
  "analytics": { "ga4": "G-YBYQXRCBLN", "gtm": "GTM-TV5RN2DB" },
  "crm": { "formId": "wicfl-quote-v1", "leadSource": "stuart-homeowners" },
  "theme": { "variant": "coastal", "accentColor": "#0F6B75" },
  "differentiation": {
    "localProof": [
      { "type": "market-data", "summary": "Demo built ahead of Pavel's retroactive SEO/niche validation (W-016) and Kevin's approved brand assets (W-008); serves only as an internal template preview, not a publishable page." }
    ],
    "uniqueSections": [
      { "title": "Waterfront and high-value home coverage explainer", "rationale": "Kevin assigned this niche directly (high-value, waterfront, coastal homes in Stuart); a real version of this section needs Pavel's local evidence and cannot be cloned from another site." }
    ]
  }
}
